{
  "taskLifecycleId": "tasklife.contract-review.20260505",
  "taskRef": "task.contract-review.001",
  "contextRef": "ctx.procurement.001",
  "providerRef": "agent.contract-review",
  "description": "Evidence lifecycle for a governed contract review task.",
  "currentState": "completed",
  "transitions": [
    {
      "fromState": "submitted",
      "toState": "working",
      "occurredAt": "2026-05-05T00:01:00Z",
      "governanceSignificance": "Execution started after descriptor and capability checks completed.",
      "evidenceRefs": [
        "evidence.request.accepted"
      ]
    },
    {
      "fromState": "working",
      "toState": "auth-required",
      "occurredAt": "2026-05-05T00:02:00Z",
      "governanceSignificance": "Agent requested delegated access to restricted contract repository.",
      "authorizationCheckpointRef": "authz.checkpoint.contract-repo.read",
      "evidenceRefs": [
        "evidence.authz.challenge"
      ]
    },
    {
      "fromState": "auth-required",
      "toState": "working",
      "occurredAt": "2026-05-05T00:04:00Z",
      "governanceSignificance": "Secondary credential supplied and scoped access approved.",
      "decisionReceiptRef": "receipt.repo.read.allow",
      "evidenceRefs": [
        "evidence.oauth.scope.contract-read"
      ]
    },
    {
      "fromState": "working",
      "toState": "completed",
      "occurredAt": "2026-05-05T00:07:00Z",
      "governanceSignificance": "Bounded artifact produced for relying-party review.",
      "artifactRefs": [
        "artifact.contract-risk-summary.001"
      ],
      "evidenceRefs": [
        "evidence.output.bound",
        "artifact.contract-risk-summary.001"
      ]
    }
  ],
  "evidencePolicyRef": "policy.task-evidence.enterprise-agent",
  "auditOutcome": "complete"
}
